{
  "$schema": "http://json-schema.org/draft-07/schema#",
  "$id": "https://benchmark.blumind.es/schemas/v1.0/response.schema.json",
  "title": "BluMind Benchmark — Response schema v1.0",
  "description": "Mandatory response format for any benchmark case. Applies both to human responses and to responses generated by LLMs. Includes mandatory traceability fields to bind the response to the system versions used.",
  "type": "object",
  "required": [
    "case_id",
    "benchmark_version",
    "subject_id",
    "subject_version",
    "run_id",
    "timestamp_utc",
    "main_hypothesis",
    "confidence",
    "key_signals",
    "alternatives",
    "requested_data",
    "recommended_action",
    "decision_change_condition"
  ],
  "properties": {
    "case_id": {
      "type": "string",
      "pattern": "^RO-(OXID|SCAL|FOUL|MECH|NOWE)-[0-9]{3}$",
      "description": "Case identifier: RO-<FAMILY>-<NNN>. v1.0 families: OXID, SCAL, FOUL, MECH, NOWE."
    },
    "benchmark_version": {
      "type": "string",
      "pattern": "^v[0-9]+\\.[0-9]+$",
      "description": "Benchmark version this response adheres to (e.g. 'v1.0'). Implicitly binds the versions of taxonomy, rubric, prompt and schema in use."
    },
    "subject_id": {
      "type": "string",
      "minLength": 1,
      "description": "Identifier of the evaluated model or system (e.g. 'gpt-5', 'claude-opus-4-6')."
    },
    "subject_version": {
      "type": "string",
      "minLength": 1,
      "description": "Specific version or snapshot of the evaluated subject (e.g. 'gpt-5-2025-08-07', 'claude-opus-4-6-20260301', 'api-build-4812'). Must be a real, pinned snapshot identifier — never an unpinned alias like 'gpt-5'."
    },
    "served_model": {
      "type": "string",
      "minLength": 1,
      "description": "Optional. Model identifier the provider actually served, as returned in the API response (with any provider/ prefix stripped). The runner verifies this matches 'subject_version' before persisting the response; persisting it here makes the traceability auditable after the fact. May be absent for non-LLM subjects (e.g. human_baseline) or when migrating older responses."
    },
    "track": {
      "type": "string",
      "enum": ["classic", "reasoning"],
      "description": "Informational annotation of the sampling mode this response was produced under, copied verbatim from the subject's sampling_policy.kind in subjects/registry.yaml. 'classic' = the v1.0 original contract with temperature=0 sent to the provider. 'reasoning' = temperature/top_p/top_k omitted, provider's deterministic defaults used, reasoning_effort declared in the registry. The leaderboard publishes a single ranking with this field rendered as an annotation column (in line with HELM, MMLU-Pro, GPQA and Artificial Analysis) — it does NOT partition the table. Optional for backward compatibility: responses generated before this field was introduced default to 'classic' at leaderboard build time."
    },
    "run_id": {
      "type": "string",
      "pattern": "^run-[0-9]{4}-[0-9]{2}-[0-9]{2}-[0-9]{3}$",
      "description": "Unique evaluation run identifier (e.g. 'run-2026-04-22-001')."
    },
    "timestamp_utc": {
      "type": "string",
      "format": "date-time",
      "description": "Response generation moment, in UTC ISO 8601."
    },
    "main_hypothesis": {
      "type": "string",
      "minLength": 1,
      "description": "Most likely technical hypothesis, in a single sentence. Must be a root cause, not a symptom."
    },
    "confidence": {
      "type": "integer",
      "minimum": 0,
      "maximum": 100,
      "description": "Subjective confidence level in the main hypothesis (0-100). Used for ECE and Brier; not scored per case."
    },
    "key_signals": {
      "type": "array",
      "items": { "type": "string", "minLength": 1 },
      "minItems": 1,
      "description": "Signals from the case statement that support the hypothesis. Forbidden to invent variables not present in the case."
    },
    "alternatives": {
      "type": "array",
      "items": {
        "type": "object",
        "required": ["hypothesis", "why_plausible", "why_discardable"],
        "properties": {
          "hypothesis": {
            "type": "string",
            "minLength": 1,
            "description": "Alternative technical hypothesis."
          },
          "why_plausible": {
            "type": "string",
            "minLength": 1,
            "description": "Why this alternative is technically plausible given the case signals."
          },
          "why_discardable": {
            "type": "string",
            "minLength": 1,
            "description": "Why this alternative is discarded in favor of the main hypothesis."
          }
        },
        "additionalProperties": false
      },
      "minItems": 1,
      "description": "Technically plausible rival hypotheses with justification. At least one required."
    },
    "requested_data": {
      "type": "string",
      "minLength": 1,
      "description": "'Trigger' datum that would most reduce uncertainty and discriminate between hypotheses."
    },
    "recommended_action": {
      "type": "string",
      "minLength": 1,
      "description": "Concrete operational action for the next hours/days, compatible with manuals."
    },
    "decision_change_condition": {
      "type": "string",
      "minLength": 1,
      "description": "Threshold or counterfactual signal under which the recommendation would change."
    }
  },
  "additionalProperties": false
}
