{
  "case_id": "RO-FOUL-004",
  "benchmark_version": "v1.0",
  "subject_id": "gemini-2-5-flash-lite",
  "subject_version": "gemini-2.5-flash-lite",
  "served_model": "gemini-2.5-flash-lite",
  "track": "classic",
  "run_id": "run-2026-05-12-001",
  "timestamp_utc": "2026-05-12T15:52:14Z",
  "main_hypothesis": "Biofouling de las membranas de RO debido a la proliferación de fitoplancton y la presencia de exopolímeros (TEP).",
  "key_signals": [
    "Clorofila-a en captación (28 µg/L vs. baseline 1,5 µg/L)",
    "TEP (320 µg/L Xeq vs. baseline < 50 µg/L Xeq)",
    "SDI₁₅ a la salida UF (3,1 vs. baseline 2,3)",
    "ΔP etapa 1 (cabeza) (3,1 bar vs. baseline 1,3 bar)",
    "TOC alimentación a RO (3,4 mg/L vs. baseline 1,2 mg/L)",
    "Filamentos visibles en muestras de alimentación y olor terroso"
  ],
  "alternatives": [
    {
      "hypothesis": "Obstrucción física por partículas inorgánicas finas.",
      "why_plausible": "Un aumento en el ΔP de la etapa 1 y una disminución en el flujo de permeado podrían ser causados por la acumulación de partículas finas en las membranas. La subida de presión de alimentación también podría ser un intento de compensar la pérdida de flujo.",
      "why_discardable": "La señal de TOC en la alimentación a RO y la cuantificación de TEP, junto con la alta concentración de clorofila-a y la observación de filamentos, apuntan fuertemente a un origen biológico. El SDI, aunque ha subido, no es extremadamente alto, lo que sugiere que la UF está reteniendo la mayor parte de las partículas gruesas, pero los exopolímeros y la materia orgánica disuelta están pasando y causando el ensuciamiento biológico en el RO."
    },
    {
      "hypothesis": "Fallo o mal funcionamiento de las membranas de UF.",
      "why_plausible": "Un aumento en el SDI a la salida de la UF (de 2,3 a 3,1) podría indicar que las membranas de UF no están reteniendo eficazmente las partículas, permitiendo que más material llegue a las membranas de RO y cause un aumento en el ΔP. El aumento de la frecuencia de retrolavado de UF también sugiere un problema en la UF.",
      "why_discardable": "Aunque el SDI ha aumentado, la subida de TEP y TOC en la alimentación a RO, junto con la clorofila-a, son indicadores de una fuente externa de ensuciamiento que está afectando tanto a la UF como al RO. El ΔP en la etapa 1 del RO es significativamente alto en comparación con la línea base, lo que sugiere un ensuciamiento más allá de lo que se esperaría solo por un ligero aumento del SDI. El olor terroso y los filamentos visibles son más consistentes con biofouling."
    },
    {
      "hypothesis": "Problema con la dosificación de coagulante (FeCl₃).",
      "why_plausible": "Una dosificación inadecuada o un fallo en la adición de coagulante podría permitir que más materia orgánica y partículas finas pasen a través del pretratamiento y lleguen a las membranas de RO, causando un aumento del ΔP.",
      "why_discardable": "No hay datos que sugieran un problema con la dosificación del coagulante. La dosificación se reporta como constante (1,5 mg/L) y no hay mención de problemas con el sistema de dosificación. La correlación temporal con la proliferación de fitoplancton y el aumento de TEP es mucho más fuerte que cualquier posible problema con el coagulante."
    }
  ],
  "requested_data": "Concentración de materia orgánica disuelta (DOC) en la alimentación a RO (mg/L).",
  "recommended_action": "Iniciar un programa de limpieza química de membranas de RO (CIP) específico para biofouling y ensuciamiento por exopolímeros. Utilizar una solución de limpieza alcalina (pH 10-11) con un agente oxidante suave (ej. peróxido de hidrógeno a 0.5-1%) o un agente tensioactivo, a una temperatura controlada (ej. 30-35 °C) durante 4-8 horas, seguido de un enjuague exhaustivo. Monitorizar el ΔP y el flujo de permeado durante y después de la limpieza.",
  "decision_change_condition": "Si la limpieza química no reduce significativamente el ΔP y el flujo de permeado, o si las pruebas posteriores revelan una alta concentración de materia inorgánica en las membranas, la hipótesis principal podría cambiar a obstrucción por partículas inorgánicas o un problema de diseño/instalación de las membranas.",
  "confidence": 90
}
